### ISSUE TITLE
Homekit intermittent problem with 'No response' on IOS devices

### ISSUE THREAD

**Issue by jr3us** [ikalchev/HAP-python#176]
Copied title over here per @cdce8p recommendation:

The issue on home assistant is #15675 has the history for what has happened, but I'll paste my last commentary here.

After uprading to 83.1 this morning, and still using the same platform as described initially, I am also seeing that I have no response more often than I have valid information in the Home app for iOS.

As @dmonagle indicated on home assistant pull request #18355, the status for devices in Home will work correctly for a few minutes, and then go No response for 4 or 5 minutes.

Side note:
I had to comment out the start up automation I used above as homeassistant complained about the action: homekit.start. I also removed the autostart False so it would start up.

Regards!

**Comment by tatunts** [comment]
Thanks for you comment @jr3us ! I am too having problems with no updates using Home Assistant and Homekit. This problem was not present for the last few months and after the latest update that includes v2.4.1 this very annoying issue started again. I really appreciate if someone could help me. Thanks a lot for the great work done here!

**Comment by ikalchev** [comment]
Hi all,

@tatunts Are you sure the issue shows up with HAP-python 2.4.1? Can someone run `netstat -an | egrep <port of HAP-python>` when the accessory goes to "No response"?

Best,
Ivan

**Comment by ikalchev** [comment]
@cdce8p In any case, can you integrate with 2.4.1, 2.4.0 is somewhat broken.

**Comment by tatunts** [comment]
Hello @ikalchev ! Thanks for you reply, really appreciate you time here.

Yes, this problem started for sure when I have updated my Hassio from 81.6 to 83.x. Sometimes it takes 10, 30 minutes or even a couple of hours after restart Home Assistant and no updates are shown on Home app if states of the devices are changed from another Home App or Home Assistant UI.

Now all devices are not updating, so I have run the command using SSH on my Hassio, here are the results (sorry, could not copy and paste from terminal):

![image](https://user-images.githubusercontent.com/25224882/49394985-69255780-f71c-11e8-938f-0e214608a0cb.png)

All devices not ending with .12 (Hassio) are iPhones and one iPad. 

Thanks a lot!

**Comment by tatunts** [comment]
Sorry if this problem is only related to the HA integration and has nothing do with your work here, I am really not sure were to go. Thanks.

**Comment by jr3us** [comment]
@ikalchev , I have done a quick check, with the following results:

iphone getting responses and working as it should.

iphone starts getting no responses with the following

pi@hassbian:~ $ netstat -al | grep -i 192.168.1.37
tcp        0      0 192.168.1.40:51827      192.168.1.37:52853      ESTABLISHED
tcp        0      0 192.168.1.40:51827      192.168.1.37:54089      ESTABLISHED

a few minutes later, iphone starts getting responses again, and the following is shown.

pi@hassbian:~ $ netstat -al | grep -i 192.168.1.37
tcp        0      0 192.168.1.40:51827      192.168.1.37:52853      ESTABLISHED
tcp        0      0 192.168.1.40:51827      192.168.1.37:54147      ESTABLISHED
tcp        0      0 192.168.1.40:51827      192.168.1.37:54089      ESTABLISHED

it then becomes responsive again.

If you need any additional info, let me know.

Regards,

**Comment by jr3us** [comment]
Side note: going back to anything prior to 2.4.0 would be bad for home assistant on hassbian for me. The newest version for me fixes the stale socket problem and keeps me from having to reboot every few days.
by the way, thanks for fixing that part!

**Comment by ikalchev** [comment]
Thank you both for the quick info. From the snippets you show me, I am pretty sure that old sockets stay in ESTABLISHED and are not closed for some reason, because I see two ports opened for the same address. I got the same behaviour on HAP-python 2.4.0, but I thought I fixed that with 2.4.1.

Does anyone knows which python version is that? Also, can you say what type of accessory (e.g. characteristics that are showing in the UI as no response) are you testing with - my local fake temperature sensor has no problems for over an hour now.

**Comment by jr3us** [comment]
hassbian is currently using either 2.7.13 or 3.5.3.  I'm not sure which one homeassistant is using.

**Comment by jr3us** [comment]
I"m pretty sure homeassistant is using 3.5 as I had to migrate to hassbian stretch since homeassistant was not happy with the version used prior to about a year or so ago.

**Comment by ikalchev** [comment]
HAP-python doesn't support 2.7, I guess you are right. Okay, I haven't tested with 3.5, let me try it.

**Comment by jr3us** [comment]
holler if you need any additional assistance!

**Comment by jr3us** [comment]
I forgot to answer the 2nd have of your question.. All of the devices go to no response. I have light switches, and a NEST thermostat with all of its bag of switches, controls, and sensors.

**Comment by tatunts** [comment]
Yes, exactly my case. Migrated to version 83. I have 107 devices configured on my setup but still using the same number as the version before, that was working perfectly.

**Comment by jr3us** [comment]
I am also running version 83.1 and hap-python is version 2.4.1.

**Comment by tatunts** [comment]
@jr3us , do you think it is possible to rever only the HomeKit component to the version that was compiled on version 81? I know that you use Hassbian, but there is a way to use the folder custom_components and put the python code there to load that component but not sure if there is a HAP-python code outside the HomeKit python code...

**Comment by tatunts** [comment]
Hello guys! I've just updated to version 83.3 of Home Assistant, I am pretty sure that it will not fix my problem since it needs to bump the version of HAP-python first but here is screen of the connections open when the system is just restarted and fully functional with HomeKit:

![image](https://user-images.githubusercontent.com/25224882/49439238-a84cba80-f7a7-11e8-9fc3-3ffaa723154d.png)

Thanks!

**Comment by ikalchev** [comment]
I am still debugging this, as I needed to setup a python 3.5 env

**Comment by cdce8p** [comment]
@tatunts Although it was working fine before, can you try reducing the number of accessories to well below 100? That's usually the suggested limit for one bridge.

As for the downgrade: It's possible but I wouldn't recommend doing it since it will probably create issues in the long run. Anyway you would need to put all files from [here](
https://github.com/home-assistant/home-assistant/tree/0.82.1/homeassistant/components/homekit) into `custom_components/homekit`.

**Comment by tatunts** [comment]
Thanks a lot @ikalchev for your time!

Many thanks @cdce8p for this info. I was wondering exacly that: does those files have everything it needs to run HomeKit? Including the HAP-python v2.3 code? That would be awesome and an easy fix for me, since this version works like a charm for me, even with 107 devices.

**Comment by cdce8p** [comment]
Yeah they should. After you have placed the files there and restarted HA, the old HAP-python version should be installed in the deps folder.

However just to iterate, I don't recommend to do so!

**Comment by tatunts** [comment]
Hello again! Just a quick update: tried to load HomeKit as custom component (v81.6) and after a an hour or so, same behavior. Also there no duplicate connections from server using the same port like before, very odd. Thanks.

**Comment by theFeverDog** [comment]
Had the same issues appear in my setup after upgrading Homeassistant to 0.83. Deleted and re-paired the bridge (which took a few tries). Problems reappeared at first but haven‘t reappeared in the past 36h. However I also manually specified the IP adress of the server after I re-paired the bridge, this might have helped with the problem.

**Comment by ikalchev** [comment]
Folks, it appears that @xbtsw may have tracked down the problem. It doesn't solve the root cause, but it should remove this issue. (see merged pull request)

Can some of you test with dev@latest? @cdce8p can you assist? Let me know if the issue is resolved.

**Comment by ikalchev** [comment]
Go for it. I can’t give advice on how to use the version from the dev branch though

**Comment by cdce8p** [comment]
> Can some of you test with dev@latest? @cdce8p can you assist?

Happy to help.

@tatunts You are using `Hassio` right? That might be a bit more difficult, since I don't know the exact path. However you would want to find the python environment -> lib -> python3.x -> site-packages -> pyhap. Maybe a search for `pyhap` does this?

For Hassbian it should be in `/srv/homeassistant/lib/python3.x/site-packages/pyhap`.

In the `pyhap` folder, you need to replace the `hap_server.py` file with this one: [hap_server.py](https://raw.githubusercontent.com/ikalchev/HAP-python/bd7638bfb51dd5e9b31dfa311ad383d319fa99b5/pyhap/hap_server.py). Remember to restart Home Assistant afterwards.

**Comment by jr3us** [comment]
worked for a few minutes,  but now no response returns.

netstat now shows no connections as follows:

pi@hassbian:~ $ netstat -an | grep 51827
tcp        0      0 192.168.1.40:51827      0.0.0.0:*               LISTEN

**Comment by jr3us** [comment]
I am using a year old ipad and an iphone SE with latest iOS in the house and on WiFi.

I did see tcp connections to them in netstat, and after a few minutes the connection went away.

I do see this in the logs:

Dec  7 08:30:19 hassbian hass[19910]: 2018-12-07 08:30:19 DEBUG (Thread-25) [pyhap.hap_server] exception [Errno 9] Bad file descriptor for ('192.168.1.23', 56783) in push_event()
Dec  7 08:30:19 hassbian hass[19910]: 2018-12-07 08:30:19 DEBUG (Thread-25) [pyhap.hap_server] Connection timeout for ('192.168.1.23', 56783) with exception [Errno 9] Bad file descriptor
Dec  7 08:30:19 hassbian hass[19910]: 2018-12-07 08:30:19 DEBUG (Thread-25) [pyhap.hap_server] Current connections {('192.168.1.23', 56784): <pyhap.hap_server.HAPSocket object at 0x5bc6ac90>, ('192.168.1.23', 56783): <pyhap.hap_server.HAPSocket object at 0x53c8f910>, ('192.168.1.29', 61404): <pyhap.hap_server.HAPSocket object at 0x51c083f0>}
Dec  7 08:30:19 hassbian hass[19910]: 2018-12-07 08:30:19 DEBUG (Thread-25) [pyhap.accessory_driver] Could not send event to ('192.168.1.23', 56783), probably stale socket.

**Comment by jr3us** [comment]
I am very comfortable with adding additional debug/ test stuff in the python code.. If you want me to add anything to hap_server.py I am willing to do that.

**Comment by tatunts** [comment]
> @tatunts You are using `Hassio` right? That might be a bit more difficult, since I don't know the exact path. However you would want to find the python environment -> lib -> python3.x -> site-packages -> pyhap. Maybe a search for `pyhap` does this?

Hello @cdce8p! Thanks for your reply.

I've search all files using the addon configurator as I can see all files outside the config folder and could not find `hap_server.py`.

I can access Hassio over SSH, do you think there is a command that I could manually update HAP-python?

If there is another way to do it, I really appreciate your help.

Thanks again my friend!

**Comment by gabgabe** [comment]
> > @tatunts You are using `Hassio` right? That might be a bit more difficult, since I don't know the exact path. However you would want to find the python environment -> lib -> python3.x -> site-packages -> pyhap. Maybe a search for `pyhap` does this?
> 
> Hello @cdce8p! Thanks for your reply.
> 
> I've search all files using the addon configurator as I can see all files outside the config folder and could not find `hap_server.py`.
> 
> I can access Hassio over SSH, do you think there is a command that I could manually update HAP-python?
> 
> If there is another way to do it, I really appreciate your help.
> 
> Thanks again my friend!

I can easy access all the files using ubuntu. Can't edit using windows or mac. I can't configure samba so I don't even know if is possible to access that partition. Waiting for your magic fixing this issue!!

**Comment by cdce8p** [comment]
@tatunts If you have access over SSH, does `SCP` work?

**Comment by tatunts** [comment]
@cdce8p yes I can, but I can see the same files as using the configurator addon...

This is the `lib` folder:

![image](https://user-images.githubusercontent.com/25224882/49660135-08a05e00-fa2d-11e8-9411-539a304fdee7.png)

I think since Hassio is like docker, file structure and access are very different from Hassbian.

**Comment by cdce8p** [comment]
Try searching for `pyhap`

**Comment by tatunts** [comment]
Hey! I think I've found it haha

![image](https://user-images.githubusercontent.com/25224882/49660322-7056a900-fa2d-11e8-9655-bc884a7f10e1.png)

**Comment by cdce8p** [comment]
Looks about right!

**Comment by tatunts** [comment]
Should I try it or wait for an update, since @jr3us said it did not work for him?

Also, @gabgabe: here is were the file is located :)

**Comment by cdce8p** [comment]
It doesn't hurt to try it. Would be interesting to see if you have the same error. Make sure to enable debug logging for all pyhap files if you haven't already.

**Comment by tatunts** [comment]
Hello @cdce8p! Sorry to bother again: actually I've found these files easily by the SAMBA share created by Hassio, on config folder. You can see the full path to this:

![image](https://user-images.githubusercontent.com/25224882/49661119-62098c80-fa2f-11e8-80ae-93ac55a8dbe0.png)

I see that it is inside Python 3.6, not 3.5 as mentioned before. Do you think that doing it just using SCP by changing that file will work? Since HomeKit component looks for the latest version of HAP-python on initialization (2.4.1)?

Sorry to bother you, I am not a coder or a Hassbian user, I really like to use Hassio because of its easy of use.

Thanks!

**Comment by tatunts** [comment]
Anyways, I've made a backup from the current `hap_server.py` file and transferred the new one. Restarting now. I'll let you know if it works. Thanks!

**Comment by gabgabe** [comment]
Tried new hap_server.py

worked fine for 10 minutes, then I ask for a command, homekit shut down the light then immediately not responding

IP 192.168.10.237 is apple tv 4th gen
other IP are other devices invited to the house (workmate iphone etc...)

` 2018-12-07 17:59:26 DEBUG (Thread-10) [pyhap.hap_server] Request PUT from address '('192.168.10.237', 49179)' for path '/characteristics'. 2018-12-07 17:59:26 DEBUG (Thread-10) [pyhap.hap_server] Set characteristics content: {'characteristics': [{'aid': 228917929, 'iid': 9, 'value': False}]} 2018-12-07 17:59:26 DEBUG (Thread-10) [pyhap.characteristic] client_update_value: On to False 2018-12-07 17:59:26 INFO (Thread-10) [pyhap.hap_server] 192.168.10.237 - "PUT /characteristics HTTP/1.1" 204 - 2018-12-07 17:59:26 DEBUG (Thread-3) [pyhap.accessory_driver] Send event: topic(228917929.9), data(b'{"characteristics": [{"aid": 228917929, "iid": 9, "value": false}]}') 2018-12-07 17:59:26 DEBUG (Thread-3) [pyhap.accessory_driver] Sending event to client: ('192.168.10.237', 49178) 2018-12-07 17:59:27 DEBUG (Thread-3) [pyhap.hap_server] exception [Errno 9] Bad file descriptor for ('192.168.10.237', 49178) in push_event() 2018-12-07 17:59:27 DEBUG (Thread-3) [pyhap.hap_server] Connection timeout for ('192.168.10.237', 49178) with exception [Errno 9] Bad file descriptor 2018-12-07 17:59:27 DEBUG (Thread-3) [pyhap.hap_server] Current connections {('192.168.10.237', 49178): <pyhap.hap_server.HAPSocket object at 0x72cfc810>, ('192.168.10.166', 58935): <pyhap.hap_server.HAPSocket object at 0x70538890>, ('192.168.10.208', 49204): <pyhap.hap_server.HAPSocket object at 0x7042c190>, ('192.168.10.188', 49968): <pyhap.hap_server.HAPSocket object at 0x6eab44b0>, ('192.168.10.222', 49184): <pyhap.hap_server.HAPSocket object at 0x7356b8f0>, ('192.168.10.237', 49179): <pyhap.hap_server.HAPSocket object at 0x70426c70>} 2018-12-07 17:59:27 DEBUG (Thread-3) [pyhap.accessory_driver] Could not send event to ('192.168.10.237', 49178), probably stale socket. 2018-12-07 17:59:27 DEBUG (Thread-3) [pyhap.accessory_driver] Sending event to client: ('192.168.10.208', 49204) 2018-12-07 17:59:27 DEBUG (Thread-3) [pyhap.accessory_driver] Sending event to client: ('192.168.10.237', 49179) 2018-12-07 17:59:27 DEBUG (Thread-3) [pyhap.accessory_driver] Sending event to client: ('192.168.10.166', 58935) 2018-12-07 17:59:27 DEBUG (Thread-3) [pyhap.hap_server] exception [Errno 9] Bad file descriptor for ('192.168.10.166', 58935) in push_event() 2018-12-07 17:59:27 DEBUG (Thread-3) [pyhap.hap_server] Connection timeout for ('192.168.10.166', 58935) with exception [Errno 9] Bad file descriptor 2018-12-07 17:59:27 DEBUG (Thread-3) [pyhap.hap_server] Current connections {('192.168.10.166', 58935): <pyhap.hap_server.HAPSocket object at 0x70538890>, ('192.168.10.208', 49204): <pyhap.hap_server.HAPSocket object at 0x7042c190>, ('192.168.10.188', 49968): <pyhap.hap_server.HAPSocket object at 0x6eab44b0>, ('192.168.10.222', 49184): <pyhap.hap_server.HAPSocket object at 0x7356b8f0>, ('192.168.10.237', 49179): <pyhap.hap_server.HAPSocket object at 0x70426c70>} 2018-12-07 17:59:27 DEBUG (Thread-3) [pyhap.accessory_driver] Could not send event to ('192.168.10.166', 58935), probably stale socket.`

**Comment by cdce8p** [comment]
I noticed the `Bad file descriptor` exception. Looks like HAP-python tries to send something to already closed sockets. However I don't know if that's also the reason all accessories turn unresponsive. @ikalchev

**Comment by ikalchev** [comment]
Unfortunately I am traveling now, I will have a look at the issue over the weekend. You all see the issue only on a RPi right?

**Comment by gabgabe** [comment]
RPi 3 B
Home Assistant 83.3 on Hass.os

Also disabled IPv6 on RPi
Tried various routers remaining on ddwrt
Apple TV on wifi
RPi on ethernet

**Comment by jr3us** [comment]
Rpi 3b also using hassbian

**Comment by xbtsw** [comment]
Hi @jr3us, it looks like you run into a similar issue I got before, and it seems not HAP-python's fault.

During my debugging, I found that

* The more apple device I have in the home, the more likely that EBADF (Bad file descriptor) could happen, this observation align with @ikalchev 's hypothesis that this could related to a racing condition.

* I also noticed that my non-hub apple devices will all keep attempting to connect old homekit hub IP address, which could be as far as more than 2 month old. I suspect this is an Apple problem, this could also happen and lead to EBADF eventually.

In the latter case, what happens on my home network is as follows:

* I have a homekit hub, it has IP address 192.168.1.113, when it have this IP address, I set it up as hub.
* I added pyhap bridge from my other device, 192.168.1.64, which cause the hub also got bridge added.
* At this point, on the raspberry (192.168.1.2), if I run `netstat`, I could see that 192.168.1.113 and 192.168.1.64 both have connection to 51827. I also confirmed that those devices are indeed making those connections individually, additionally, 192.168.1.64 also have a connection with 192.168.1.113, which makes sense.
* Sometimes, 192.168.1.64 will drop its connection with 192.168.1.2, but still maintain the connection with 192.168.1.113, in which case, home app still works. Note that this happens even when everything are all on wifi.
* My other devices on the home will also behave similar to 192.168.1.64, i.e. they sometimes connect to hub only, sometimes also connect directly with pyhap.
* It has been working since, **with the EBADF patched** as you could seen in my PR, with this, EBADF happens rarely, but it still does happen. I also noted that it never happens for a socket to 192.168.1.113 (hub), only to devices like 192.168.1.64
* At some point my DHCP server suddenly decided to change the IP address of my hub, from 192.168.1.113 to 192.168.1.89. One would expect this to be OK, since Hub could notify other devices about this change thru iCloud.
* In reality this didn't seem to happen, 192.168.1.64 will still attempting to connect with 192.168.1.113 which no longer exists, even hours or days after the IP change. When attempting, 192.168.1.64 will attempt to establish socket with 192.168.1.113 at rate of ~10 times per second, and Home app interface shows "Updating". After about 5~10 seconds it gives up and concluded "No response". **No attempt is made to connect with 192.168.1.89**, which is the current IP of the hub.
* Now if you go to raspberry, you will see there's connection from 192.168.1.89 meaning hub is connected but useless since non of the devices could find the hub.
* If I use an iPad as a hub I could see that even the iPad is attempting to connect to 192.168.1.113, despite itself is already connected to bridge. I assumed that the process manages the hub and Home app is isolated and they communicate exclusively thru iCloud, which seems to contain the wrong IP.
* I have tried following but none of them seems to nudge the system and make it realize that hub now has a new IP, after these I could see that they are still attempting to connect with 192.168.1.113.
  * reboot individual device.
  * shutdown all devices
  * remove and re-add bridge
  * factory reset hub.
* Note that if I remove and re-add bridge, it will make it work for roughly 10 minutes because by adding the bridge the device will have a direct connection with pyhap, but after this connection drops and it trying to find the hub, which it can't, we will back to "No Response".
* At this point if I assign 192.168.1.113 to the Hub, everything starts to work.
* The only way I found so far, to make the system update hub's IP address, is to do **all** of following:
  * shutdown all devices.
  * delete the home
  * reset Hub

So if you are already in this situation, you need to either:
* figure out what IP the system "think" your hub is, then assign that IP to the hub, or
* set a static IP to your hub and reset everything.

**Comment by tatunts** [comment]
Hello everyone! Just a quick update: I've been running the Homekit component on Hassio for 5 hours now, been out of home, used over 4G, returned, check on all three devices and it works PERFECTLY!

Many thanks for all of you involved that took the time and knowledge to help.

Thanks @cdce8p, @ikalchev and @xbtsw for coding and testing!

I believe the state change instability is fixed but will test it for a couple of days and get back to you.

Very optimistic! This is really important to me because my mistress only uses the Home App to control all devices at home, so you can imagine what I was going trough hahah

Thanks again! 😄

**Comment by jr3us** [comment]
My network

raspberry pi running hassbian/homekit:   192.168.1.40 ( Wired )
Apple TV 4k as an apple homekit hub:     192.168.1.23 (wireless AC)
Apple IPhone SE:                         192.168.1.37 ( Wireless AC)
Apple IPad:                              192.168.1.29 ( Wireless AC)

Note that the ip addresses are all static.

When the devices are in the house and are on the wifi network is when i have problems. When I am away from the house on the cellular network, I do see the same issues referenced. Since I am away from the house the connections will come from the Apple TV.

When I am in the house and my iphone is connected to wifi, from what i can tell my iphone never connects through the apple tv. I can also tell that my ipad never connects through the apple tv. my iphone se is the only device that connects through the apple tv, and this happens only when used when using the cell phone network.

As noted in earlier comments, my instance of homekit is using python 3.5 on hassbian whereas  @tatunts and @gabgabe are using hassio and python 3.6.

Don't know if this is having an affect or not.

I am not sure where this will go now.

**Comment by jr3us** [comment]
Additional observation:  when devices become unresponsive, it takes just over 5 minutes for the connection to return. when connection returns, it lasts around 2 minutes before it becomes unresponsive again, showing stale sockets in the log. Rinse, lather, repeat and the cycle begins again.

**Comment by cdce8p** [comment]
@xbtsw Thanks for the great summary on your issues! I conclud that static IP addresses could help?

After all these different error descriptions, I'am wondering if we happen to talk about the same problem. Or if all of them just manifest the same way,

**Comment by xbtsw** [comment]
@cdce8p so if one is starting fresh then a static IP could avoid problem. Otherwise need to resort to one of the two methods I mentioned.

Looks like there’s couple of root cause to “No response”, my EBADF patch seems to fixed it for me and @tatunts , I described another possible root cause I was running into, seems like a bug on Apple’s side.

**Comment by jr3us** [comment]
I am currently upgrading my iphone to 12.1.1. Once complete, I will see how it works then.

**Comment by jr3us** [comment]
could it be related to the linux kernel? I do an rpi-update fairly frequently, and here is the current version:

pi@hassbian:~ $ uname -a
Linux hassbian 4.14.84-v7+ #1169 SMP Thu Nov 29 16:20:43 GMT 2018 armv7l GNU/Linux

**Comment by jr3us** [comment]
upgrading my phone to 12.1.1 didnt change the results.

**Comment by ikalchev** [comment]
Okay so I got to my pi finally (been testing on macOS this week).

* Everything is DHCP.
* RPi 3, Raspbian Linux pi3 4.9.52-v7+ #1038 SMP Fri Sep 29 16:26:52 BST 2017 armv7l GNU/Linux
* python 3.6.5
* HAP-python is latest from dev
* Two iOS clients
* A fake switch accessory (because it's completely client-driver, i.e. the server does not push anything so no way to find out if the client is dead)

I had the accessory running for 10 minutes without any commands from the Home app, just keeping my iPhone awake - no issues. I tried turning the switch on and off, turning the wi-fi off and on again, etc. - no problems.

Based on what you folks are saying:
1. There is probably a race, which @xbtsw took care of.
2. I am starting to think the on-going issues are seen on python 3.5 only.

I will explore 2 now. Let me know if I am missing something.

**Comment by jr3us** [comment]
I see your version of python is 3.6. How did you get that on standard raspbian?

I am also going to reimage with the latest hassbian today to see if it changes. I will keep my current image as well.

**Comment by ikalchev** [comment]
> I see your version of python is 3.6. How did you get that on standard raspbian?

I built&installed it from source

**Comment by jr3us** [comment]
@ikalchev : you are using a hassbian image with python 3.5 that you have manually compiled/installed v3.6 correct?

also, when you were running it with 3.5, did you see the errors?

with 3.6 are you still seeing the errors?

**Comment by ikalchev** [comment]
No, I am using a regular raspbian with manual build of python 36. I am yet to test with 3.5.

**Comment by jr3us** [comment]
Ok, I have started a fresh instance on hassbian with standard 3.5 python and installed the new hap_server.py referenced above.  

For about the first hour homekit works ok, but after that the cycling no response starts up.

**Comment by xbtsw** [comment]
I am running a standard Raspbian lite and just installed python3 from apt. It is 3.5.3.

**Comment by jr3us** [comment]
@xbtsw : Verifying, are you seeing the problem with no response on lite with 3.5.3? That is the same version as i referenced.

**Comment by xbtsw** [comment]
I was seeing it because of two problems, the EBADF and home app keep
connecting to old IP.

After I overcame these two, I am running fine now for couple of weeks.

It seems you have a different problem though. You can try sniffing with
Wireshark and see what your devices are doing.

**Comment by jr3us** [comment]
I updated to python 3.6 about an hour ago on my fresh test instance. I then powered off and powered back on. So far it is running ok. we'll see how it does.

Incidentally, even though my devices are all on dhcp except for the hass server, none of the devices has changed ip address. I'm not convinced yet this is similar to what you mentioned regarding changing ip address.

Thanks,

**Comment by jr3us** [comment]
@cdce8p , @ikalchev , @xbtsw : It has been a about an hour and a half since I upgraded to 3.6.7, and accessories stopped responding. They are now cycling as I have indicated earlier.

Not sure what to do with this now.

**Comment by ikalchev** [comment]
Are there any errors in the logs? Do you mind pasting those?

**Comment by jr3us** [comment]
I have grabbed information since midnight my time today and have pasted it into github at:

https://raw.githubusercontent.com/jr3us/logs/master/hap.log

The following information will let you know what the ip addresses in my network are for apple devices:

raspberry pi running hassbian/homekit: 192.168.1.40 ( Wired )
Apple TV 4k as an apple homekit hub: 192.168.1.23 (wireless AC)
Apple IPhone SE: 192.168.1.37 ( Wireless AC)
Apple IPad: 192.168.1.29 ( Wireless AC)

I made the log above public so you should be able to see it.

This will show the cyclical response / no response that is occurring.  

If i need to add addtional debug or debug statements, let me know.

Regards,

**Comment by theFeverDog** [comment]
I reverted back to Homeassistant 0.81.6 and the "No response" errors do not appear any more. I also applied the EBADF fix on 0.83.3, but the errors returned after 1 hour.

In Homeassistant 0.81.6 the pyhap version is 2.2.2. In 0.83.3 it is 2.4.1.

**Comment by ikalchev** [comment]
So we narrowed down the change that causes this (it’s in HAPSocket), but I don’t know why yet.

**Comment by jr3us** [comment]
@ikalchev , thanks for the update!

**Comment by theFeverDog** [comment]
Great to hear!

**Comment by bluepixel00** [comment]
Glad I stumbled onto this thread.  I am not having the "no response" issue on the home app but any automation that uses a HomeKit device from home assistant will stop working after a random time when using any HA version newer than 0.81.6.  When I go back to 0.81.6 the automations are stable.

Can my issue be related to this issue? Thanks!

**Comment by warcanoid** [comment]
@bluepixel same problem

**Comment by badstraw360** [comment]
Do you guys know the path to replace the file in docker? I'm using a pi..

**Comment by scottyphillips** [comment]
Im trying to figure that out myself; also using Pi running hassio

**Comment by jr3us** [comment]
according to @warcanoid just above you, here is the information:

@BLUEPIXEL same problem, do this:
thanks to @ikalchev, on hassio, you just copy this file: [https://raw.githubusercontent.com/ikalchev/HAP-python/bd7638bfb51dd5e9b31dfa311ad383d319fa99b5/pyhap/hap_server.py] in /config/deps/lib/python3.6/site-packages/pysimplesoap/hap_server.py, restart and works well on 0.84.3 and now on 0.84.5

**Comment by jr3us** [comment]
@ikalchev , any additional information I can provide to help you with this?

**Comment by scottyphillips** [comment]
Thats great, and thanks so much for pointing that out, except that site-package is not there in my instance...

**Comment by jr3us** [comment]
I use hassbian so I am not knowledgeable directly regarding hassio/hassos setup. You may have to adapt, and explore the directory structure a bit to find where it is exactly. the find command would also be helpful to locate it if you can get ssh access.

**Comment by scottyphillips** [comment]
Will do. Hopefully something pops up. 
First time caller here, but will make the general comment that Home Assistant seems to be completely all over the shop with Hassbian vs standalone docker containers vs Hassio

**Comment by scottyphillips** [comment]
I ended up using the custom deps tool to deploy HAP-python, which in turn correctly deployed 'pyhap' into the 'deps' folder. From there you can put the dev version of 'hap_server' into /config/deps/lib/python3.6/site-packages/pyhap/

**Comment by WhiteDogBe** [comment]
@scottyphillips I'm trying the same thing, but only getting a few files in /config/deps/lib/python3.6/site-packages/pyhap/. No hap_server.py also.

What did you put as the config in the custom deps addon? The documentation of that add-on is dead so I took a guess and used:

`{
  "pypi": [
    "pyhap"
  ],
  "apk": []
}`

**Comment by scottyphillips** [comment]
Hey mate, try this:

{
  "pypi": [
      “hap_python==2.4.1"
  ],
  "apk": []
}

**Comment by WhiteDogBe** [comment]
@scottyphillips awesome, that worked 🥇 
Did you also replace the hap_server.py with the one mentioned above or is that one already in the 2.4.1 ? I'm assuming also replace the file.

**Comment by scottyphillips** [comment]
Yes, the Deps manager will deploy 2.4.1 'main', and what you are doing is replacing the 'hap_server.py' file with the one out of 'dev' 2.4.1 (as per above)

**Comment by WhiteDogBe** [comment]
@scottyphillips I was already using static IP's for most all my Apple devices. For me the issue only occurs after a number of hours, maybe because of this. Will report back in 24 hours.

**Comment by scottyphillips** [comment]
Yeah, exactly the same, runs perfectly for anywhere between 5-10 hours, then just completely falls over.

**Comment by ikalchev** [comment]
Hi all,

It’s great to see that you did so much debugging. I was busy these days and will try to catch up around the holidays.

After the 4-5 hour period, can someone see the amount of sockets opened by HAP? Also if the address of the host where HAP runs has changed address. Finally some debug logs from the run may be helpful.

And to clarify- the current dev version mitigates the issue or it resolves it?

**Comment by WhiteDogBe** [comment]
@ikalchev notifications are still working for me at this time. What's a good command to get the sockets? Here is my output from netstat -an:

```
core-ssh:/config/deps/lib/python3.6/site-packages/pyhap# netstat -an
Active Internet connections (servers and established)
Proto Recv-Q Send-Q Local Address           Foreign Address         State
tcp        0      0 0.0.0.0:22              0.0.0.0:*               LISTEN
tcp        0      0 127.0.0.11:34101        0.0.0.0:*               LISTEN
tcp        0      0 172.30.33.0:22          192.168.0.101:54335     ESTABLISHED
tcp        0      0 172.30.33.0:22          192.168.0.101:54284     ESTABLISHED
tcp        0      0 :::22                   :::*                    LISTEN
udp        0      0 127.0.0.11:58109        0.0.0.0:*
Active UNIX domain sockets (servers and established)
Proto RefCnt Flags       Type       State         I-Node Path
unix  2      [ ]         STREAM     CONNECTED     1581446
unix  2      [ ]         STREAM     CONNECTED     1579151
```

**Comment by warcanoid** [comment]
I have only this folder: /config/deps/lib/python3.6/site-packages/pysimplesoap, but it is working, how to get/install/update on hassio pyhap folder?

**Comment by WhiteDogBe** [comment]
@warcanoid I followed the method @scottyphillips used:
1. In Hass.io > Add-on store > Install "Custom deps deployment" (do not set to auto-start!)
2. Set the config in "Custom deps deployment" to the below and Start the plugin once:

```yaml
{
  "pypi": [
      “hap_python==2.4.1"
  ],
  "apk": []
}
```
3. you should now have /config/deps/lib/python3.6/site-packages/pyhap/ where you can repalce hap_server.py. Then restart Hass.io, should work.

**Comment by warcanoid** [comment]
Can not do this, it is red and wont save

**Comment by warcanoid** [comment]
Wont save: http://imgur.com/AaAQTmw

**Comment by jr3us** [comment]
@ikalchev , I am still having the no response problem an hour or 2 after the initial reboot.

I am using version 2.4.1  and also note that I did update to python 3.6 using the instructions posted to update python.  
2.4.1 did *MAYBE* increase the amount of time that it worked after initial update, however as mentioned the no response / responding cycle didn't change. As far as I can tell python 3.6 did not change things vs 3.5 for standard hassbian.

Thanks!

**Comment by warcanoid** [comment]
@WhiteDogBe thank you, have it now, the folder is there and the file is changed. After 3 hours everything ok, waiting to tomorrow

**Comment by scottyphillips** [comment]
No issues for me after over 12 hours now. All my devices have static IPs now too which may be helping

**Comment by jr3us** [comment]
I did an update to .84.6 today and updated hassbian as well. I also set the iPhone, iPad, and Apple TV 4K to fixed dhcp addresses.
Since I did the above , there have been no no response problems for 5 hours. I will report back tomorrow regarding results then.

@ikalchev , @cdce8p  :  if things are still good tomorrow, I am going to go back to standard dhcp with no fixed addresses for the iPad iPhone and Apple TV.  Normal users would never used fixed addresses in their home for handhelds.

Note that the hassbian server does have a fixed address and should never have a non static address.

Hopefully this is all sorted out now.
Regards!

**Comment by jr3us** [comment]
@ikalchev , @cdce8p :  I have allowed it to run overnight with static ips configured for the apple tv, iphone, and ipad and it has been working fine for 20hours.

I am converting the atv, iphone, and ipad back to non static ips, and will watch it. 

I did reboot the hassbian server for a clean start.

Regards!

**Comment by jr3us** [comment]
22 hours later, and there have been no issues when using dynamic ips using DHCP.  I think this issue is fixed now ( or fixed itself !).

Thanks to @ikalchev , @cdce8p , and @xbtsw!

**Comment by jr3us** [comment]
When this has migrated to production, This issue can be closed from my perspective.

Regards!

**Comment by nicx** [comment]
I have recognized the same problem some versions of HA ago... great to read that there is a fix on the way to production. Thanks a lot to all of you 😊

**Comment by shred86** [comment]
I’m not having the No Response issue but HomeKit automations from Home Assistant HomeKit devices will stop working after a period of time, which sounds like it might be related to this. I’m assuming we’ll need a 2.4.2 version released, and an update on the Home Assistant side before we see this fix? Any idea how long this might be? Just wondering if I should wait for the release or go ahead and apply the fix now. Thanks for all the work from everyone. Really hoping this fixes the issues.

**Comment by bluepixel00** [comment]
This is exactly the same issue I had but it was solved with installing the unreleased version of hap_server.py as detailed above.  I am 3 days running without any issues.

Installation depends on your setup but all details are above in this thread.

**Comment by ikalchev** [comment]
I am glad to hear that the fix is working. I will try to release the fixes tomorrow under v2.4.1.

**Comment by shred86** [comment]
Just installed the updated hap_server.py so I'll see if it fixes my issues. However, now if I have my iOS Home app open and the state changes on a light or sensor (i.e. light is turned on or motion sensor detects something), the Home app doesn't update in real time. It use to do this before, but now I have to close and re-open the Home app to see the accurate state. Not sure if this is related to any changes that were made to hap_server.py. Not a huge issue, but still nice to have real time updates without having to close/open the Home app.

**Comment by jr3us** [comment]
by the way, still working fine with no problems for over 3 days!

**Comment by shred86** [comment]
Well, the good news for me is my automations appear to be working as expected after about 10 hours. Usually by now they've stopped working. However, I'm still having an issue where occasionally I'll turn on a light switch (physical button press), Home Assistant sees it but HomeKit does not. I was hoping they were all related, but likely another issue. ;)

**Comment by stich86** [comment]
this haven't solved my issue. My HA Homekit still goes on "No Response" after 5 minutes of restart :(
any hints?

**Comment by dmonagle** [comment]
Mine also still  goes to no response  this on Hassio.  It’s on my To Do list for this holidays to set up my entire system from scratch. I’ll be interested to see if that makes any difference

**Comment by stich86** [comment]
> Are you guys sure you properly installed the unreleased version? When I initially set it up I it it didn’t work but ran though the setup again and then it started working and I am at 4 days without a problem.

i'm using the hap_server.py on the latest commit and then restarted HA

**Comment by bluepixel00** [comment]
I am not sure if this was the last commit but I used this https://raw.githubusercontent.com/ikalchev/HAP-python/bd7638bfb51dd5e9b31dfa311ad383d319fa99b5/pyhap/hap_server.py

**Comment by bluepixel00** [comment]
Run a diff between this and what you installed to see if there are any differences.

**Comment by stich86** [comment]
> Run a diff between this and what you installed to see if there are any differences.

it's the same.. i've removed now the bridge and homekit state file, so tonight i will repair it again with my phone an check if it's stable or not

**Comment by xbtsw** [comment]
@dmonagle Could you provide debug level log from hass when devices turns into no response?

**Comment by shred86** [comment]
Not sure if this is all related to the same issue but I made a post on the Home Assistant github about HomeKit not receiving the correct device states when Home Assistant is. I believe it’s actually an issue with HAP-python but I posted the logs in the post I made:

https://github.com/home-assistant/home-assistant/issues/19604

**Comment by stich86** [comment]
this is my  home-assistant logs. Now with the modified version i see a lot of "stale errors".

10.0.1.61 is my iPhone
10.0.1.83 is ATV4 (used as home hub for remote access)


[home-assistant.zip](https://github.com/ikalchev/HAP-python/files/2714546/home-assistant.zip)

**Comment by shred86** [comment]
Looking through @stich86 logs, I'm seeing some similar errors in mine but it appears the difference is in my case, it appears when it gets the "probably stale socket", the next entries show pyhap.accessory_driver successfully executing the "Sending event to client" to the same IP address but with a different socket that is successful. In @stich86 case, it just keeps trying to send to that same socket over and over, which I'm assuming is leading to the "No Response".

My log:

```
2018-12-29 11:10:14 DEBUG (Thread-4) [pyhap.accessory_driver] Sending event to client: ('172.16.16.17', 59630)
2018-12-29 11:10:14 DEBUG (Thread-4) [pyhap.hap_server] exception [Errno 9] Bad file descriptor for ('172.16.16.17', 59630) in push_event()
2018-12-29 11:10:14 DEBUG (Thread-4) [pyhap.hap_server] Connection timeout for ('172.16.16.17', 59630) with exception [Errno 9] Bad file descriptor
2018-12-29 11:10:14 DEBUG (Thread-4) [pyhap.hap_server] Current connections {('172.16.16.26', 49335): <pyhap.hap_server.HAPSocket object at 0x6fc2a3f0>, ('172.16.16.36', 49274): <pyhap.hap_server.HAPSocket object at 0x755da030>, ('172.16.16.32', 49306): <pyhap.hap_server.HAPSocket object at 0x6fc2a9f0>, ('172.16.16.34', 52505): <pyhap.hap_server.HAPSocket object at 0x6fc377f0>, ('172.16.16.34', 52504): <pyhap.hap_server.HAPSocket object at 0x6fc2a3d0>, ('172.16.16.30', 49197): <pyhap.hap_server.HAPSocket object at 0x6fc2a6f0>, ('172.16.16.31', 52031): <pyhap.hap_server.HAPSocket object at 0x6fc37910>, ('172.16.16.23', 56810): <pyhap.hap_server.HAPSocket object at 0x6fc37f70>, ('172.16.16.17', 59630): <pyhap.hap_server.HAPSocket object at 0x6e2dfef0>, ('172.16.16.31', 52032): <pyhap.hap_server.HAPSocket object at 0x7305e510>, ('172.16.16.17', 59667): <pyhap.hap_server.HAPSocket object at 0x6e3b87d0>}
2018-12-29 11:10:14 DEBUG (Thread-4) [pyhap.accessory_driver] Could not send event to ('172.16.16.17', 59630), probably stale socket.
2018-12-29 11:10:14 DEBUG (Thread-4) [pyhap.accessory_driver] Sending event to client: ('172.16.16.17', 59667)
2018-12-29 11:10:14 DEBUG (Thread-4) [pyhap.accessory_driver] Sending event to client: ('172.16.16.31', 52032)
2018-12-29 11:10:14 DEBUG (Thread-4) [pyhap.accessory_driver] Sending event to client: ('172.16.16.30', 49197)
2018-12-29 11:10:14 DEBUG (Thread-4) [pyhap.accessory_driver] Sending event to client: ('172.16.16.23', 56810)
```

@stich86 log:

```
2018-12-27 17:57:38 DEBUG (Thread-26) [pyhap.accessory_driver] Sending event to client: ('10.0.1.61', 53795)
2018-12-27 17:57:38 DEBUG (Thread-26) [pyhap.hap_server] exception [Errno 9] Bad file descriptor for ('10.0.1.61', 53795) in push_event()
2018-12-27 17:57:38 DEBUG (Thread-26) [pyhap.hap_server] Connection timeout for ('10.0.1.61', 53795) with exception [Errno 9] Bad file descriptor
2018-12-27 17:57:38 DEBUG (Thread-26) [pyhap.hap_server] Current connections {('10.0.1.61', 53793): <socket.socket [closed] fd=-1, family=AddressFamily.AF_INET, type=SocketKind.SOCK_STREAM, proto=0>, ('10.0.1.61', 53795): <pyhap.hap_server.HAPSocket object at 0x61d8bb10>}
2018-12-27 17:57:38 DEBUG (Thread-26) [pyhap.accessory_driver] Could not send event to ('10.0.1.61', 53795), probably stale socket.
2018-12-27 17:57:38 DEBUG (Thread-26) [pyhap.accessory_driver] Send event: topic(1021904600.12), data(b'{"characteristics": [{"value": 23.0, "aid": 1021904600, "iid": 12}]}')
2018-12-27 17:57:38 DEBUG (Thread-26) [pyhap.accessory_driver] Sending event to client: ('10.0.1.83', 49732)
2018-12-27 17:57:38 DEBUG (Thread-26) [pyhap.hap_server] socket not found for ('10.0.1.83', 49732) in push_event()
2018-12-27 17:57:38 DEBUG (Thread-26) [pyhap.accessory_driver] Could not send event to ('10.0.1.83', 49732), probably stale socket.
2018-12-27 17:57:38 DEBUG (Thread-26) [pyhap.accessory_driver] Sending event to client: ('10.0.1.61', 53843)
2018-12-27 17:57:38 DEBUG (Thread-26) [pyhap.hap_server] socket not found for ('10.0.1.61', 53843) in push_event()
2018-12-27 17:57:38 DEBUG (Thread-26) [pyhap.accessory_driver] Could not send event to ('10.0.1.61', 53843), probably stale socket.
2018-12-27 17:57:38 DEBUG (Thread-26) [pyhap.accessory_driver] Sending event to client: ('10.0.1.83', 49733)
2018-12-27 17:57:38 DEBUG (Thread-26) [pyhap.hap_server] socket not found for ('10.0.1.83', 49733) in push_event()
2018-12-27 17:57:38 DEBUG (Thread-26) [pyhap.accessory_driver] Could not send event to ('10.0.1.83', 49733), probably stale socket.
```

**Comment by scottyphillips** [comment]
Unfortunately there are still issues that seem to be related to bad file descriptors. This is some of my debug output:
```
018-12-30 17:45:45 DEBUG (Thread-3) [pyhap.accessory_driver] Send event: topic(1055917812.9), data(b'{"characteristics": [{"aid": 1055917812, "iid": 9, "value": false}]}')
2018-12-30 17:45:45 DEBUG (Thread-3) [pyhap.accessory_driver] Sending event to client: ('192.168.1.8', 49189)
2018-12-30 17:45:45 DEBUG (Thread-3) [pyhap.hap_server] exception [Errno 9] Bad file descriptor for ('192.168.1.8', 49189) in push_event()
2018-12-30 17:45:45 DEBUG (Thread-3) [pyhap.hap_server] Connection timeout for ('192.168.1.8', 49189) with exception [Errno 9] Bad file descriptor
2018-12-30 17:45:45 DEBUG (Thread-3) [pyhap.hap_server] Current connections {('192.168.1.4', 49159): <pyhap.hap_server.HAPSocket object at 0xb3db4430>, ('192.168.1.8', 49189): <pyhap.hap_server.HAPSocket object at 0xb142e430>, ('192.168.1.11', 53223): <pyhap.hap_server.HAPSocket object at 0xb1493e50>, ('192.168.1.5', 51959): <pyhap.hap_server.HAPSocket object at 0xb14499d0>, ('192.168.1.11', 53234): <pyhap.hap_server.HAPSocket object at 0xb1493cd0>}
2018-12-30 17:45:45 DEBUG (Thread-3) [pyhap.accessory_driver] Could not send event to ('192.168.1.8', 49189), probably stale socket.
2018-12-30 17:45:45 DEBUG (Thread-3) [pyhap.accessory_driver] Sending event to client: ('192.168.1.4', 49159)
2018-12-30 17:45:45 DEBUG (Thread-3) [pyhap.hap_server] exception [Errno 9] Bad file descriptor for ('192.168.1.4', 49159) in push_event()
2018-12-30 17:45:45 DEBUG (Thread-3) [pyhap.hap_server] Connection timeout for ('192.168.1.4', 49159) with exception [Errno 9] Bad file descriptor
2018-12-30 17:45:45 DEBUG (Thread-3) [pyhap.hap_server] Current connections {('192.168.1.4', 49159): <pyhap.hap_server.HAPSocket object at 0xb3db4430>, ('192.168.1.11', 53223): <pyhap.hap_server.HAPSocket object at 0xb1493e50>, ('192.168.1.5', 51959): <pyhap.hap_server.HAPSocket object at 0xb14499d0>, ('192.168.1.11', 53234): <pyhap.hap_server.HAPSocket object at 0xb1493cd0>}
2018-12-30 17:45:45 DEBUG (Thread-3) [pyhap.accessory_driver] Could not send event to ('192.168.1.4', 49159), probably stale socket.
2018-12-30 17:45:45 DEBUG (Thread-3) [pyhap.accessory_driver] Sending event to client: ('192.168.1.11', 53223)
2018-12-30 17:46:13 DEBUG (MainThread) [homeassistant.components.homekit.accessories] New_state: <state switch.tplink_one=off; friendly_name=Pool Light @ 2018-12-30T17:46:13.591075+11:00>
2018-12-30 17:46:13 DEBUG (SyncWorker_0) [homeassistant.components.homekit.type_switches] switch.tplink_one: Set current state to False
2018-12-30 17:46:13 DEBUG (SyncWorker_0) [pyhap.characteristic] set_value: On to False
2018-12-30 17:46:13 DEBUG (Thread-3) [pyhap.accessory_driver] Send event: topic(1055917812.9), data(b'{"characteristics": [{"aid": 1055917812, "iid": 9, "value": false}]}')
2018-12-30 17:46:13 DEBUG (Thread-3) [pyhap.accessory_driver] Sending event to client: ('192.168.1.11', 53223)
2018-12-30 17:46:42 DEBUG (Thread-8) [pyhap.hap_server] Connection timeout for ('192.168.1.11', 53223) with exception [Errno 104] Connection reset by peer
2018-12-30 17:46:42 DEBUG (Thread-8) [pyhap.hap_server] Current connections {('192.168.1.11', 53223): <pyhap.hap_server.HAPSocket object at 0xb1493e50>, ('192.168.1.5', 51959): <pyhap.hap_server.HAPSocket object at 0xb14499d0>, ('192.168.1.11', 53234): <pyhap.hap_server.HAPSocket object at 0xb1493cd0>}
2018-12-30 17:46:42 DEBUG (Thread-8) [pyhap.hap_server] Connection timeout
2018-12-30 17:55:46 WARNING (SyncWorker_2) [custom_components.climate.mitsubishi] HA requested an update from HVAC 192.168.1.6 but no data was received
2018-12-30 18:17:06 WARNING (MainThread) [homeassistant.components.http.ban] Login attempt or request with invalid authentication from 192.168.1.5
```

**Comment by ikalchev** [comment]
I think the problem with the “Bad file descriptor” comes from the fact when a request is handled (i.e. the connection is closed), the server does not purge the socket from its list of active connections. So the send event tries to talk on a closed socket fd. 

But the fix that got in a few days back should remediate this, because it catches the exception and purges the socket.

I will submit a fix for the root cause soon and then probably do a release so people can more easily upgrade. Then we will see if there are still issues.

**Comment by scottyphillips** [comment]
Thanks Ivan, you guys have coded an awesome library, I am happy to help test any which way I can.

**Comment by ikalchev** [comment]
I just pushed some changes. It would be really helpful if someone can fetch latest from dev and give it a try.

Best,
Ivan

**Comment by tatunts** [comment]
Testing it right now, will get back to you in a couple of days. Thanks!

**Comment by jr3us** [comment]
@ikalchev: Is test_hap_server.py required for validating the changes? or just the hap_server.py

thanks!

**Comment by ikalchev** [comment]
Just `hap_server.py`

**Comment by jr3us** [comment]
thanks!  I now have the new version in as well and will let you know how it is doing tomorrow!

**Comment by warcanoid** [comment]
@ikalchev components are updating/refreshing very very fast in home app. That had been slow before, and needed somethimes long time

**Comment by ikalchev** [comment]
To be honest, I am not sure if this is because of the changes I made, but I am glad to hear that nevertheless :)

**Comment by scottyphillips** [comment]
Still seeing an issue with 'stale sockets' even with running the latest dev version of hap_server.py from dev.
```
019-01-04 11:16:17 DEBUG (Thread-3) [pyhap.accessory_driver] Could not send event to ('192.168.1.4', 51468), probably stale socket.
2019-01-04 11:16:17 DEBUG (Thread-3) [pyhap.accessory_driver] Send event: topic(2199783975.12), data(b'{"characteristics": [{"aid": 2199783975, "iid": 12, "value": 25.0}]}')
2019-01-04 11:16:17 DEBUG (Thread-3) [pyhap.accessory_driver] Sending event to client: ('192.168.1.8', 51773)
2019-01-04 11:16:17 DEBUG (Thread-3) [pyhap.accessory_driver] Sending event to client: ('192.168.1.4', 51468)
2019-01-04 11:16:17 DEBUG (Thread-3) [pyhap.hap_server] No socket for ('192.168.1.4', 51468)
2019-01-04 11:16:17 DEBUG (Thread-3) [pyhap.accessory_driver] Could not send event to ('192.168.1.4', 51468), probably stale socket.
2019-01-04 11:16:17 DEBUG (Thread-3) [pyhap.accessory_driver] Send event: topic(2199783975.13), data(b'{"characteristics": [{"aid": 2199783975, "iid": 13, "value": 0}]}')
2019-01-04 11:16:17 DEBUG (Thread-3) [pyhap.accessory_driver] Sending event to client: ('192.168.1.8', 51773)
2019-01-04 11:16:17 DEBUG (Thread-3) [pyhap.accessory_driver] Sending event to client: ('192.168.1.4', 51468)
2019-01-04 11:16:17 DEBUG (Thread-3) [pyhap.hap_server] No socket for ('192.168.1.4', 51468)
2019-01-04 11:16:17 DEBUG (Thread-3) [pyhap.accessory_driver] Could not send event to ('192.168.1.4', 51468), probably stale socket.
2019-01-04 11:16:17 DEBUG (Thread-3) [pyhap.accessory_driver] Send event: topic(2199783975.10), data(b'{"characteristics": [{"aid": 2199783975, "iid": 10, "value": 2}]}')
2019-01-04 11:16:17 DEBUG (Thread-3) [pyhap.accessory_driver] Sending event to client: ('192.168.1.8', 51773)
2019-01-04 11:16:18 DEBUG (Thread-3) [pyhap.accessory_driver] Sending event to client: ('192.168.1.4', 51468)
2019-01-04 11:16:18 DEBUG (Thread-3) [pyhap.hap_server] No socket for ('192.168.1.4', 51468)
2019-01-04 11:16:18 DEBUG (Thread-3) [pyhap.accessory_driver] Could not send event to ('192.168.1.4', 51468), probably stale socket.
2019-01-04 11:16:18 DEBUG (Thread-3) [pyhap.accessory_driver] Send event: topic(2199783975.9), data(b'{"characteristics": [{"aid": 2199783975, "iid": 9, "value": 2}]}')
2019-01-04 11:16:18 DEBUG (Thread-3) [pyhap.accessory_driver] Sending event to client: ('192.168.1.8', 51773)
2019-01-04 11:16:18 DEBUG (Thread-3) [pyhap.accessory_driver] Sending event to client: ('192.168.1.4', 51468)
2019-01-04 11:16:18 DEBUG (Thread-3) [pyhap.hap_server] No socket for ('192.168.1.4', 51468)
2019-01-04 11:16:18 DEBUG (Thread-3) [pyhap.accessory_driver] Could not send event to ('192.168.1.4', 51468), probably stale socket.
2019-01-04 11:16:51 DEBUG (Thread-10) [pyhap.hap_server] Cleaning connection to ('192.168.1.8', 51773)
2019-01-04 11:21:22 WARNING (SyncWorker_4) [custom_components.climate.mitsubishi] HA requested an update from HVAC 192.168.1.6 but no data was received
2019-01-04 11:25:26 DEBUG (MainThread) [homeassistant.components.homekit.accessories] New_state: <state climate.mitsubishi_ducted=cool; current_temperature=25, min_temp=7, max_temp=35, temperature=25, fan_mode=medium-high, fan_list=['low', 'medium-high'], operation_mode=cool, operation_list=['heat', 'cool', 'fan_only', 'auto', 'off'], friendly_name=Mitsubishi Ducted, supported_features=4289 @ 2019-01-04T10:03:06.682219+11:00>
2019-01-04 11:25:26 DEBUG (SyncWorker_1) [pyhap.characteristic] set_value: CurrentTemperature to 25.0
2019-01-04 11:25:26 DEBUG (SyncWorker_1) [pyhap.characteristic] set_value: TargetTemperature to 25.0
2019-01-04 11:25:26 DEBUG (Thread-3) [pyhap.accessory_driver] Send event: topic(2199783975.11), data(b'{"characteristics": [{"aid": 2199783975, "iid": 11, "value": 25.0}]}')
2019-01-04 11:25:26 DEBUG (Thread-3) [pyhap.accessory_driver] Sending event to client: ('192.168.1.8', 51773)
2019-01-04 11:25:26 DEBUG (SyncWorker_1) [pyhap.characteristic] set_value: TemperatureDisplayUnits to 0
2019-01-04 11:25:26 DEBUG (SyncWorker_1) [pyhap.characteristic] set_value: TargetHeatingCoolingState to 2
2019-01-04 11:25:26 DEBUG (Thread-3) [pyhap.hap_server] No socket for ('192.168.1.8', 51773)
2019-01-04 11:25:26 DEBUG (Thread-3) [pyhap.accessory_driver] Could not send event to ('192.168.1.8', 51773), probably stale socket.
2019-01-04 11:25:26 DEBUG (SyncWorker_1) [pyhap.characteristic] set_value: CurrentHeatingCoolingState to 0
2019-01-04 11:25:26 DEBUG (Thread-3) [pyhap.accessory_driver] Send event: topic(2199783975.12), data(b'{"characteristics": [{"aid": 2199783975, "iid": 12, "value": 25.0}]}')
2019-01-04 11:25:26 DEBUG (Thread-3) [pyhap.accessory_driver] Sending event to client: ('192.168.1.8', 51773)
2019-01-04 11:25:26 DEBUG (Thread-3) [pyhap.hap_server] No socket for ('192.168.1.8', 51773)
2019-01-04 11:25:26 DEBUG (Thread-3) [pyhap.accessory_driver] Could not send event to ('192.168.1.8', 51773), probably stale socket.
2019-01-04 11:25:26 DEBUG (Thread-3) [pyhap.accessory_driver] Send event: topic(2199783975.13), data(b'{"characteristics": [{"aid": 2199783975, "iid": 13, "value": 0}]}')
2019-01-04 11:25:26 DEBUG (Thread-3) [pyhap.accessory_driver] Sending event to client: ('192.168.1.8', 51773)
2019-01-04 11:25:26 DEBUG (Thread-3) [pyhap.hap_server] No socket for ('192.168.1.8', 51773)
2019-01-04 11:25:26 DEBUG (Thread-3) [pyhap.accessory_driver] Could not send event to ('192.168.1.8', 51773), probably stale socket.
2019-01-04 11:25:26 DEBUG (Thread-3) [pyhap.accessory_driver] Send event: topic(2199783975.10), data(b'{"characteristics": [{"aid": 2199783975, "iid": 10, "value": 2}]}')
2019-01-04 11:25:26 DEBUG (Thread-3) [pyhap.accessory_driver] Sending event to client: ('192.168.1.8', 51773)
2019-01-04 11:25:26 DEBUG (Thread-3) [pyhap.hap_server] No socket for ('192.168.1.8', 51773)
2019-01-04 11:25:26 DEBUG (Thread-3) [pyhap.accessory_driver] Could not send event to ('192.168.1.8', 51773), probably stale socket.
2019-01-04 11:25:26 DEBUG (Thread-3) [pyhap.accessory_driver] Send event: topic(2199783975.9), data(b'{"characteristics": [{"aid": 2199783975, "iid": 9, "value": 0}]}')
2019-01-04 11:25:26 DEBUG (Thread-3) [pyhap.accessory_driver] Sending event to client: ('192.168.1.8', 51773)
2019-01-04 11:25:26 DEBUG (Thread-3) [pyhap.hap_server] No socket for ('192.168.1.8', 51773)
2019-01-04 11:25:26 DEBUG (Thread-3) [pyhap.accessory_driver] Could not send event to ('192.168.1.8', 51773), probably stale socket.
```

**Comment by ikalchev** [comment]
Having stale sockets is expected, because iOS doesn’t always close connections. What worries me is that you are seeing this for the same address-port pair even though it should be removed as soon as a stale socket happens. Will investigate

**Comment by ikalchev** [comment]
@scottyphillips stale sockets aside, are you having any issues with HAP-python, I.e. what is the issue at hand now?

**Comment by scottyphillips** [comment]
Hi Ivan,

Overall the service seems more reliable then a few weeks ago, it’s certainly not dropping every couple of hours. It can stay up and running for almost a day at a time, but then something odd happens and it just falls over. Restarting the docker container always fixes it.

Next time it falls over I will send you my entire debug log.

Regards, Scott

Sent from my iPhone

On 4 Jan 2019, at 5:57 pm, Ivan Kalchev <notifications@github.com<mailto:notifications@github.com>> wrote:


@scottyphillips<https://github.com/scottyphillips> stale sockets aside, are you having any issues with HAP-python, I.e. what is the issue at hand now?

**Comment by ikalchev** [comment]
Yes, that will be helpful. Because seeing stale sockets is normal as I have already said and now that the crashing is fixed, this should not be the source of your problem. Next time the service fails send me the logs.

Thanks!

**Comment by stich86** [comment]
Nothing to do for me. I’ve installed HA on docker and put latest version of hap_server.py. Started from scratch on my iPhone (removed and added again back the bridge), but after few seconds all accessories go back to “No response”. Homebridge running on the same Docker host is very stable :( May be is my Ubiquiti Network the problem? I don’t think so because as I’ve said homebridge works with any issue and ATV, iPhone and HA are on the same subnet.

**Comment by ikalchev** [comment]
@stich86 can we see some logs from the time it goes to "No response"?

**Comment by stich86** [comment]
I’ll try to upload them tomorrow. Now I’m doing a stupid test. I’ve shutdown the ATV4 and now seems that alla accessories are responding. I will wait few hours to see if it’s stable or not and the power on again the ATV4 let you know

**Comment by ikalchev** [comment]
FYI, just released 2.4.2 - it contains fixes for at least two of the issues. I am keeping this open until we verify that this issue is resolved for good (we can open a separate bug if the issue is different). @cdce8p I would strongly recommend bumping pyhap in HA should you have the time.

**Comment by cdce8p** [comment]
I already opened the PR: https://github.com/home-assistant/home-assistant/pull/19776
For everybody using Home Assistant: The update should be included with `0.85.0b1`.

@ikalchev Thanks for your continued work on this issue! I would do more if I could, but sadly I don't have a lot of experience with networking stuff :confused:

**Comment by ikalchev** [comment]
Thanks, but I wish I had more time to spare on this project.

Yeah networking is a beach.

**Comment by stich86** [comment]
here is my log
the problem is ATV4. If i turn it off, my iPhone Home App works without problem, when turn it on i start to put all accessories to "No Response". I've altro tried to disable into "Account\iCloud\Homekit" option and for few seconds iPhone Home Apps works again :(

my iPhone has IP 10.0.1.61 while ATV4 is 10.0.1.83

Hope you can help me..

[home-assistant.zip](https://github.com/ikalchev/HAP-python/files/2728745/home-assistant.zip)

**Comment by stich86** [comment]
But the problem in my case is that both ATV and iPhone for some minutes work at the same time, then stop

**Comment by jr3us** [comment]
3 days later, and the modifications are working fine for me.

Thanks @ikalchev !

**Comment by tatunts** [comment]
Hello @ikalchev! Thank you very much for your work here. Been using the new version for a few days now and it works perfectly, all devices updates much faster and no disconnects/unavailable messages for me now. Have a great day!

**Comment by bluepixel00** [comment]
@ikalchev  Everything has been running great for me as well with 2.4.2.  Thanks for all your hard with resolving this!

**Comment by gschindel** [comment]
Does anyone know how to apply this patch for hassio? The path provided above isn't valid in hassio.

**Comment by bluepixel00** [comment]
Add the core custom dependency from the add-on page and add the following config to the options page of the add-on

{
  "pypi": [
    "hap_python==2.4.2"
  ],
  "apk": []
}

I had a problem where it kept pulling 2.4.1 after rebooting so I just pulled the hap_server.py from 2.4.2 and overwrote what it kept pulling back 2.4.1.  I think there is a way to tell it it is ok to use another version but just did it this way.

**Comment by bluepixel00** [comment]
Making sure you are truly using 2.4.2.  As I said, I set it to 2.4.2  but it kept changing to 2.4.1 as I think that is the version that the last version of home assistant required.

After you reboot did you verify the name of the folder for the custom dependency?  Mine was showing 2.4.1 so I manually pulled over hap_server.py from 2.4.2 over 2.4.1.

I am looking to see how you can change the requirement with custom dependency so it does not get changed..

**Comment by tatunts** [comment]
Hello @bluepixel00, thanks for your reply. This is what my folders looks like:

![image](https://user-images.githubusercontent.com/25224882/50789570-c83e3500-12a3-11e9-90f5-88dbe1d2769d.png)

Not sure how to check if `hap_server.py` is the latest version...

Thanks.

**Comment by bluepixel00** [comment]
Is that after a full reboot of home assistant?  The best way is to perform a diff on hap_server with what you have vs what is in 2.4.2.  You could assume that you do not have the latest and replace hap_server in that folder with what you see in 2.4.2 from git.

There are much smarter people on here so they may have a better way.  I could not find out how to change the requirement With custom dependency.

**Comment by warcanoid** [comment]
> Hello @bluepixel00, thanks for your reply. This is what my folders looks like:
> 
> ![image](https://user-images.githubusercontent.com/25224882/50789570-c83e3500-12a3-11e9-90f5-88dbe1d2769d.png)
> 
> Not sure how to check if `hap_server.py` is the latest version...
> 
> Thanks.

you have updated hap, now overwrite-copy the the new hap_server.py and reboot on more time

**Comment by warcanoid** [comment]
@tatunts @ikalchev I have the same problem as tatunts, homekit stopped at night after half day, when i updated hap-python and hap-server

**Comment by warcanoid** [comment]
@tatunts @ikalchev have updated to 2.4.2 hap_python and hap server yesterday, at night homekit stopped. Have restarted now to see what will happen

**Comment by tatunts** [comment]
Hello @bluepixel00. Yes, I believe there is a problem using the custom dependency method. After applying the fix by copying the modified file manually everything is now working correctly again. I will not mess with it again and wait for vertion 85 of HA that includes the update. Thanks!

**Comment by gschindel** [comment]
It's still unclear to me where to copy the fix to when running hassio. The package path mentioned above (/srv/homeassistant/lib/python3.x/site-packages/pyhap) does not exist in hassio,

**Comment by bluepixel00** [comment]
At this point just wait for HA 0.85 to come out tomorrow which is supposed to include it by default.

If you can't wait as was noted above: To get hassio to use something other than the built in packages you need to install the core custom dependency package under add ons in hassio.  For the config of the package set the following and run it once to have it download everything you need. Do not set it to autorun.  If you run it again it will overwrite whatever is already in the folder.

{
"pypi": [
"hap_python==2.4.2"
],
"apk": []
}

Stop the add-on and copy the hap_server.py file from the config folder under the site packages.  Reboot HA and overwrite the hap_server.py with the file you copied and reboot once more.

**Comment by HerveB** [comment]
Hi Ivan,

I still have the issue... I went through the same steps as others in the forum, including upgrading to 2.4.2 and then realizing that it was over-written with 2.4.1 when Hass.io at reboot. Any suggestion?

On a side note, I have a working Homeseer + Homebridge installation that has been rock solid when it comes to Homekit integration. I would like to migrate to HA but the Homekit issue has been a show stopper.

Thanks,
Herve

**Comment by tatunts** [comment]
> Hi Ivan,
> 
> I still have the issue... I went through the same steps as others in the forum, including upgrading to 2.4.2 and then realizing that it was over-written with 2.4.1 when Hass.io at reboot. Any suggestion?
> 
> On a side note, I have a working Homeseer + Homebridge installation that has been rock solid when it comes to Homekit integration. I would like to migrate to HA but the Homekit issue has been a show stopper.
> 
> Thanks,
> Herve

Hello! Have you updated your HA to v85? It has the latest version of pyhap...

**Comment by HerveB** [comment]
No, I am still on Hass.io 0.8.4. I though it is the latest version.

**Comment by HerveB** [comment]
Alright... 0.8.5 upgrade literally appeared between me checking versions and my response to you.... :-)
Let me check if 0.8.5 fix my problem... Do I have to got through the hap_python overwrite with 0.8.5 or is it taken care of by the upgrade?

Thanks for you fast response!

**Comment by gschindel** [comment]
No issues here since updating to 0.85.0.

**Comment by HerveB** [comment]
I checked it throughout the day after upgrading. The problem persists. I am going to do a separate fresh installation and test again.

**Comment by scottyphillips** [comment]
I’ve just upgraded this morning and turned off the custom component. Less then a hour later it has stopped working. I won’t be able to determine what has happened until after I get back from work.

**Comment by bluepixel00** [comment]
@scottyphilips make sure you remove the custom dep files as well to make sure it is not trying to pull from there..

**Comment by HerveB** [comment]
I did: I renamed the /deps/lib folder to /deps/lib-old

**Comment by HerveB** [comment]
I no longer have a HAP_python-2.4.2 distribution folder in /deps. I assumed  the upgrade to 0.85 took care of upgrading HAP_python bundle with hass.io.
Should I go through the manual update of HAP_python to 2.4.2?

**Comment by speedfire514** [comment]
I also experienced that issue. I waited until 0.85 to check it out. I tried 0.85.1 (which is badly tagged as -dev0 btw). I deleted my accessories in homekit app on ios. I managed to reimport them all being online but a couple of minute later and "no response" again. I successfully poked HAP from a telnet session on the correct homekit port. I'm starting to wondering if the bug is not in the ios app.

**Comment by HerveB** [comment]
Quick update. I did a brand new installation of 0.85 with only HomeKit and z-wave configured with a z-wave outlet. I have the same issue.
I can use Homekit to turn on/off the z-wave outlet 2-5 times before the status of the device becomes "no response"".
I can use Hass.io GUI to turn on/off the z-wave device even when it is showed as "no response" in Homekit.
I don't have issue with my production home automation system that is using Homeseer+Homebridge.

**Comment by ikalchev** [comment]
@HerveB, @speedfire514, can you upload logs from around the time the issue happened?

**Comment by speedfire514** [comment]
@ikalchev sure ! Actually I planned to took at hap_python today to track the bug. With all my test yesterday I found a pattern in the log. I will post them here later today
@HerveB if you use home assistant like me, what I did was, turning debug log on for HomeKit in configuration.xml. 
logger:
  default: warning
  logs:
    homeassistant.components.homekit: debug

Then the hap-python log will be output in your home-assistant directory in a file home-assistant.log. You can tail it to point what’s going on when the bug occurred.

If you got a couple of stale fd/ socket error maybe netstat / lsof -p might help

**Comment by HerveB** [comment]
Alright, I did two runs with the same configuration. First run, it took half-a-dozen of times turning on/off my test outlet for the device status to become "no response". The second time took many more on/off actions to get to "no response".

Note that in this configuration, I have 2 z-wave devices exposed as switches in Homekit: my test outlet (HomeSeer outlet), an Aeotec ZW078 Heavy Duty Smart Switch Gen5.

[run-2-home-assistant.log](https://github.com/ikalchev/HAP-python/files/2753431/run-2-home-assistant.log)

[run-1-home-assistant.log](https://github.com/ikalchev/HAP-python/files/2753427/run-1-home-assistant.log)

**Comment by theFeverDog** [comment]
While experimenting with 0.84 and previous versions in December, I noticed that while the „non response“ was more frequent in 0.84, it also crept over time back when reverting to an older version.

I finally tracked the root cause for the disconnects to my Netgear switch, which apparently had an incorrect implementation of IGMP snooping according to several support forums. After disabling IGMP snooping on the switch I‘ve been running without a problem for several weeks now.

**Comment by HerveB** [comment]
I happen to be using a Netgear Prosafe switch. I followed your recommendation and disabled IGMP snooping. I will re-run the test.

Thanks @theFeverDog !

**Comment by speedfire514** [comment]
I did no change to my router. I deactivated wlan and route all traffic thru Ethernet. So far so good, no problem... Can you all confirm you experience the issue on Wifi ?

**Comment by stich86** [comment]
Yes.. my ATV and of course iPhone are on WLAN.

**Comment by jr3us** [comment]
Since you have brought up netgear switches, That peaked my memory a bit. I had to switch from a 4 year old Netgear N750 wireless router to an Apple airport extreme about the time mine started working. I had to switch because the netgear was having problems with stability and wouldn't remember its settings when using it with a fiber internet connection.

Short story is .. the netgear router may have been my problem with the no response. Hard to tell because I switched to 2.4.1 hap_server at the same time.

I have been using the Apple airport extreme with no problems since mid december with no further 'No Response' problems
.

**Comment by HerveB** [comment]
I am still testing with IGMP snooping disabled in my Netgear switch. So far, so good: it seems the problem went away. I will continue testing.

However, I had to reboot the Hass.io Raspberry Pi a couple of times until HomeKit started working properly. Not sure why. I have attached the logs.

[run-3-home-assistant.log](https://github.com/ikalchev/HAP-python/files/2753514/run-3-home-assistant.log)

**Comment by scottyphillips** [comment]
Very Interesting, my router is a Netgear as well, I might take the same action and disable the IGMP snooping as well.

Regards,

Scott Phillips

Sent from my iPhone

On 14 Jan 2019, at 7:49 am, Hervé <notifications@github.com<mailto:notifications@github.com>> wrote:


I am still testing with IGMP snooping disabled in my Netgear switch. So far, so good: it seems the problem went away. I will continue testing.

However, I had to reboot the Hass.io<http://Hass.io> Raspberry Pi a couple of times until HomeKit started working properly. Not sure why. I have attached the logs.

run-3-home-assistant.log<https://github.com/ikalchev/HAP-python/files/2753514/run-3-home-assistant.log>

**Comment by HerveB** [comment]
Reporting back: HomeKit has been working without a glitch since yesterday after I applied the switch configuration changes recommended by @theFeverDog.

Thanks all for your help!

**Comment by speedfire514** [comment]
I've got no problem either. For the record, I don't have a netgear router, neither have ICMP snooping activated. The only change was using ethernet instead of Wifi on my home assistant server (rasp Pi3 B+).

On the other side, even if that solves the problem, having stale file handles (for my case) looks like some badly used resources while working in degradated mode. I feel we can do better handling this cases.

**Comment by stich86** [comment]
disabled every IGMP feature on my UniFi network a no joy... :(

**Comment by HerveB** [comment]
@speedfire514, I add a similar issue when I used wifi instead of ethernet. It seems the wifi interface goes to sleep. You can turn off power management to avoid the issue by adding the following lines to the network configuration file:

[wifi]
powersave=0

For more details:
https://github.com/home-assistant/hassos/blob/dev/Documentation/network.md

**Comment by theFeverDog** [comment]
Glad that a few other people seem to be able to resolve their issues. 

Here's a [link](https://community.netgear.com/t5/Smart-Plus-Click-Switches/Bonjour-Service-Discovery-Problems/td-p/1380173) to one of the forum posts on MDNS/Bonjour issues. I have a JGS516PE ProSafe switch.

**Comment by stich86** [comment]
it's obviously a problem of this library and some network equipement. As I've said Homebridge and also HomeKit native accessories works without issue

**Comment by scottyphillips** [comment]
I’m not sure if that comment is helpful. The devs are doing as best a job as they can on software that doesn’t cost a penny for folk like us to run. Ivan and cdece8p are working as hard as they can to resolve the issues in their spare time. More constructive support would be useful not ‘obvious’ criticism… Why don’t you learn python and debug the library yourself?

**Comment by stich86** [comment]
sorry I did not want to be offensive.
i'll try to debug myself.. how to put more verbose logging on the library?

**Comment by ikalchev** [comment]
Hey no harm done, but thanks for the support.

What I meant with my earlier comment was that the mDNS library that HAP-python uses (zeroconf) could have issues leading to the accessory being in no response state. 

To enable more logging just set the global logging level to DEBUG (don;t know if there is a cli/config way to do this in HA).

**Comment by scottyphillips** [comment]
I will say that the 2.4.2 fix overall has absolutely improved reliability, but agree there is something else is causing strange issues. Mine will work 1-3 days with zero problems then just sort of cease operating - "no response" - like everyone else, but no obvious signs in the logs other then the expected 'stale' socket timeouts, so the zeroconf issue I reckon is worth investigating for sure...

**Comment by stich86** [comment]
checking the logs i got this behaviour:

> 2019-01-15 11:52:21 INFO (Thread-6) [pyhap.hap_server] Got connection with ('10.0.1.83', 49394).
> 2019-01-15 11:52:21 DEBUG (Thread-7) [pyhap.hap_server] Request POST from address '('10.0.1.83', 49394)' for path '/pair-verify'.
> 2019-01-15 11:52:21 INFO (Thread-7) [pyhap.hap_server] 10.0.1.83 - "POST /pair-verify HTTP/1.1" 200 -
> 2019-01-15 11:52:21 DEBUG (Thread-7) [pyhap.hap_server] Request POST from address '('10.0.1.83', 49394)' for path '/pair-verify'.
> 2019-01-15 11:52:21 DEBUG (Thread-7) [pyhap.hap_server] Pair verify with client '('10.0.1.83', 49394)' completed. Switching to encrypted transport.
> 2019-01-15 11:52:21 INFO (Thread-7) [pyhap.hap_server] 10.0.1.83 - "POST /pair-verify HTTP/1.1" 200 -
> 2019-01-15 11:52:21 DEBUG (Thread-7) [pyhap.hap_server] Request GET from address '('10.0.1.83', 49394)' for path '/accessories'.
> 2019-01-15 11:52:21 INFO (Thread-7) [pyhap.hap_server] 10.0.1.83 - "GET /accessories HTTP/1.1" 200 -
> 2019-01-15 11:53:14 DEBUG (Thread-7) [pyhap.hap_server] Cleaning connection to ('10.0.1.83', 49394)


> 2019-01-15 12:04:33 INFO (Thread-6) [pyhap.hap_server] Got connection with ('10.0.1.83', 49395).
> 2019-01-15 12:04:33 DEBUG (Thread-103) [pyhap.hap_server] Request POST from address '('10.0.1.83', 49395)' for path '/pair-verify'.
> 2019-01-15 12:04:33 INFO (Thread-103) [pyhap.hap_server] 10.0.1.83 - "POST /pair-verify HTTP/1.1" 200 -
> 2019-01-15 12:04:33 DEBUG (Thread-103) [pyhap.hap_server] Request POST from address '('10.0.1.83', 49395)' for path '/pair-verify'.
> 2019-01-15 12:04:33 DEBUG (Thread-103) [pyhap.hap_server] Pair verify with client '('10.0.1.83', 49395)' completed. Switching to encrypted transport.
> 2019-01-15 12:04:33 INFO (Thread-103) [pyhap.hap_server] 10.0.1.83 - "POST /pair-verify HTTP/1.1" 200 -
> 2019-01-15 12:04:33 DEBUG (Thread-103) [pyhap.hap_server] Request GET from address '('10.0.1.83', 49395)' for path '/accessories'.
> 2019-01-15 12:04:33 INFO (Thread-103) [pyhap.hap_server] 10.0.1.83 - "GET /accessories HTTP/1.1" 200 -
> 2019-01-15 12:05:23 DEBUG (Thread-103) [pyhap.hap_server] Cleaning connection to ('10.0.1.83', 49395)

if you see the last two lines of each attempt, about 1 minute after the connection to hap_server is cleaned an my accessories on the Home App goes to "No Response". Currently i'm doing all tests using remote access, so this IP is the Apple TV now.

Checking the code, i see this function is called at line 857 of hap_server.py

>         finally:
>             logger.debug('Cleaning connection to %s', client_address)
>             conn_sock = self.connections.pop(client_address, None)
>             if conn_sock is not None:
>                 self._close_socket(conn_sock)

**Comment by stich86** [comment]
another attemp:

i've removed all accessories from homekit instance and leave only a single switch (to avoid a conflict with some accessories): 

```
2019-01-15 12:58:03 INFO (Thread-9) [pyhap.hap_server] 10.0.1.83 - "GET /accessories HTTP/1.1" 200 -
2019-01-15 12:58:04 DEBUG (Thread-9) [pyhap.hap_server] Request PUT from address '('10.0.1.83', 49407)' for path '/characteristics'.
2019-01-15 12:58:04 DEBUG (Thread-9) [pyhap.hap_server] Set characteristics content: {'characteristics': [{'aid': 2812874781, 'iid': 13, 'ev': True}]}
2019-01-15 12:58:04 DEBUG (Thread-9) [pyhap.accessory_driver] Subscribed client ('10.0.1.83', 49407) to topic 2812874781.13
2019-01-15 12:58:04 INFO (Thread-9) [pyhap.hap_server] 10.0.1.83 - "PUT /characteristics HTTP/1.1" 204 -
2019-01-15 12:58:04 DEBUG (Thread-9) [pyhap.hap_server] Request PUT from address '('10.0.1.83', 49407)' for path '/characteristics'.
2019-01-15 12:58:04 DEBUG (Thread-9) [pyhap.hap_server] Set characteristics content: {'characteristics': [{'aid': 2828406909, 'iid': 13, 'ev': True}]}
2019-01-15 12:58:04 DEBUG (Thread-9) [pyhap.accessory_driver] Subscribed client ('10.0.1.83', 49407) to topic 2828406909.13
2019-01-15 12:58:04 INFO (Thread-9) [pyhap.hap_server] 10.0.1.83 - "PUT /characteristics HTTP/1.1" 204 
2019-01-15 12:58:56 DEBUG (Thread-9) [pyhap.hap_server] Cleaning connection to ('10.0.1.83', 49407)
```

The cleaning connection seems sent by the ATV:

```
12:58:56.430024 IP 10.0.1.83.49407 > 10.0.1.100.51827: Flags [F.], seq 1898234225, ack 1635920380, win 2048, options [nop,nop,TS val 388394304 ecr 304249976], length 0
        0x0000:  4500 0034 0000 4000 4006 240e 0a00 0153  E..4..@.@.$....S
        0x0010:  0a00 0164 c0ff ca73 7124 c171 6182 29fc  ...d...sq$.qa.).
        0x0020:  8011 0800 fb7c 0000 0101 080a 1726 6d40  .....|.......&m@
        0x0030:  1222 7c78                                ."|x
12:58:56.430205 IP 10.0.1.83.49407 > 10.0.1.100.51827: Flags [F.], seq 0, ack 1, win 2048, options [nop,nop,TS val 388394304 ecr 304249976], length 0
        0x0000:  4500 0034 0000 4000 4006 240e 0a00 0153  E..4..@.@.$....S
        0x0010:  0a00 0164 c0ff ca73 7124 c171 6182 29fc  ...d...sq$.qa.).
        0x0020:  8011 0800 fb7c 0000 0101 080a 1726 6d40  .....|.......&m@
        0x0030:  1222 7c78                                ."|x
12:58:56.431499 IP 10.0.1.100.51827 > 10.0.1.83.49407: Flags [F.], seq 1, ack 1, win 260, options [nop,nop,TS val 304301557 ecr 388394304], length 0
        0x0000:  4500 0034 1444 4000 4006 0fca 0a00 0164  E..4.D@.@......d
        0x0010:  0a00 0153 ca73 c0ff 6182 29fc 7124 c172  ...S.s..a.).q$.r
        0x0020:  8011 0104 16dd 0000 0101 080a 1223 45f5  .............#E.
        0x0030:  1726 6d40                                .&m@
12:58:56.432092 IP 10.0.1.100.51827 > 10.0.1.83.49407: Flags [F.], seq 1, ack 1, win 260, options [nop,nop,TS val 304301557 ecr 388394304], length 0
        0x0000:  4500 0034 1444 4000 4006 0fca 0a00 0164  E..4.D@.@......d
        0x0010:  0a00 0153 ca73 c0ff 6182 29fc 7124 c172  ...S.s..a.).q$.r
        0x0020:  8011 0104 38fa 0000 0101 080a 1223 45f5  ....8........#E.
        0x0030:  1726 6d40                                .&m@
12:58:56.436464 IP 10.0.1.83.49407 > 10.0.1.100.51827: Flags [.], ack 2, win 2048, options [nop,nop,TS val 388394309 ecr 304301557], length 0
        0x0000:  4500 0034 0000 4000 4006 240e 0a00 0153  E..4..@.@.$....S
        0x0010:  0a00 0164 c0ff ca73 7124 c172 6182 29fd  ...d...sq$.ra.).
        0x0020:  8010 0800 31f9 0000 0101 080a 1726 6d45  ....1........&mE
        0x0030:  1223 45f5                                .#E.
12:58:56.436464 IP 10.0.1.83.49407 > 10.0.1.100.51827: Flags [.], ack 2, win 2048, options [nop,nop,TS val 388394309 ecr 304301557], length 0
        0x0000:  4500 0034 0000 4000 4006 240e 0a00 0153  E..4..@.@.$....S
        0x0010:  0a00 0164 c0ff ca73 7124 c172 6182 29fd  ...d...sq$.ra.).
        0x0020:  8010 0800 31f9 0000 0101 080a 1726 6d45  ....1........&mE
        0x0030:  1223 45f5                                .#E.
```

it looks like the ATV send a POST request to HA (waiting for some data) and then it close the connnection

**Comment by stich86** [comment]
ok i think that i've found the problem (but not the cause).. When HK working, the mDNS entry is correctly sent by HA in this way:

![screenshot_1](https://user-images.githubusercontent.com/27808541/51186654-65b7eb00-18da-11e9-8b58-d779a8bb855c.jpg)

After few seconds it send an advertise with PTR and no IP inside

![screenshot_2](https://user-images.githubusercontent.com/27808541/51186677-736d7080-18da-11e9-87f0-76dbba5807f5.jpg)

For example Homebridge advertise PTR in this way:

![screenshot_3](https://user-images.githubusercontent.com/27808541/51186727-9a2ba700-18da-11e9-8989-ffed6ab85ea6.jpg)

Any suggestion?

**Comment by stich86** [comment]
and this also confirmed looking at avahi cache:

+ ovs_eth0 IPv4 Home Assistant Bridge                         _hap._tcp            local
+ ovs_eth0-2 IPv4 Home Assistant Bridge                         _hap._tcp            local
- ovs_eth0-2 IPv4 Home Assistant Bridge                         _hap._tcp            local
- ovs_eth0 IPv4 Home Assistant Bridge                         _hap._tcp            local
+ ovs_eth0 IPv4 Home Assistant Bridge                         _hap._tcp            local
+ ovs_eth0-2 IPv4 Home Assistant Bridge                         _hap._tcp            local
- ovs_eth0-2 IPv4 Home Assistant Bridge                         _hap._tcp            local
- ovs_eth0 IPv4 Home Assistant Bridge                         _hap._tcp            local
+ ovs_eth0 IPv4 Home Assistant Bridge                         _hap._tcp            local
+ ovs_eth0-2 IPv4 Home Assistant Bridge                         _hap._tcp            local
- ovs_eth0-2 IPv4 Home Assistant Bridge                         _hap._tcp            local
- ovs_eth0 IPv4 Home Assistant Bridge                         _hap._tcp            local
+ ovs_eth0 IPv4 Home Assistant Bridge                         _hap._tcp            local
+ ovs_eth0-2 IPv4 Home Assistant Bridge                         _hap._tcp            local
- ovs_eth0-2 IPv4 Home Assistant Bridge                         _hap._tcp            local
- ovs_eth0 IPv4 Home Assistant Bridge                         _hap._tcp            local
+ ovs_eth0 IPv4 Home Assistant Bridge                         _hap._tcp            local
+ ovs_eth0-2 IPv4 Home Assistant Bridge                         _hap._tcp            local
- ovs_eth0-2 IPv4 Home Assistant Bridge                         _hap._tcp            local
- ovs_eth0 IPv4 Home Assistant Bridge                         _hap._tcp            local

"+" sings are record added on the cache, while "-" are the removed one

**Comment by dmonagle** [comment]
The one thing that has always stood out to me in this thread was that many people were have some success, often for hours before the dreaded "No response". I've always struggled to have it go for two or three minutes.

After seeing the posts regarding IGMP snooping on the Netgear Switch, I figured I'd take a look at mine. It's a Netgear ProSAFE JGS524PE.

Sure enough, IGMP is on be default and, amazingly, turning it off immediately has resulted in me being about to control things for a much longer period of time. I'm at about 15 minutes so far and have been switching things on and off constantly.

Now this wasn't an issue with Homebridge so there is obviously something going on here that could, in theory, be fixed. I'm happy for there to be a note on the library - and probably one added in HomeKit to point out this current limitation. As long as my AppleTV streaming continues to function well without IGMP snooping on, I'm fine to leave it off.

Thanks @ikalchev for all the work you've put into helping everybody out here. It's very hard to fix things you can't reproduce yourself. Thanks @theFeverDog for discovering the IGMP thing too!

**Comment by ikalchev** [comment]
The logs from @stich86 could be really helpful. Will have a look as soon as I can.

**Comment by stich86** [comment]
Did you have a change to look at my logs? Thanks!

**Comment by ikalchev** [comment]
Not yet, but I managed to get my hands on a setup with a HomeKit hub through an iPad to try to reproduce this. So far nothing, but I will continue to debug this.

**Comment by stich86** [comment]
@ikalchev

How can i set zeroconf debug inside the logger of accerssory.py? I’ve opened an issue on the zeroconf library and Jakub ask me some logs putting library in debug 

Thanks

**Comment by stich86** [comment]
@ikalchev 

did you have time to look at this issue? i'm trying to debug zeroconf, but i don't know how to put on debug :(

thanks!

**Comment by speedfire514** [comment]
Just to keep you updated. My problem with my devices in homekit becoming unresponsive has been fixed. @HerveB Thanks for giving me hints. I still don't know how exactly I did manage to make it work. But for the record here what I did. I'm running HA straight into a Rasbian stretch distro into docker 
1) updated to the latest HA (0.88.0 at the moment).
2) using all HA prerequisite packages including app armor and network manager
3) configured my wifi in raspi-config
4) For some reason network manager won't fully work because gnome use its own network manager (nmcli reported weird IP etc...). I followed https://raspberrypi.stackexchange.com/questions/29783/how-to-setup-network-manager-on-raspbian

More than one weeks and everything looks good from the homekit app. I did not look into the log to see what has changed yet. Either I fixed my network driver instability (which we should be more reliable anyway) or 0.88 fixed it (which I highly doubt as I saw no update around HAP)

**Comment by stich86** [comment]
Finally i've solved my problem.

It was related to zeroconf lib. I've found a mode to put it on debug and there was an issue regarding mDNS reflector used by my USG gateway. 

Essentially on first mDNS request from HA, the reflector send this request on others VLAN but also on the same where it received. For a strange behavior, the zeroconf library for a PTR record request (that in this case was a question sent by HA itself) reply with another mDNS request and this deleted my cache an make HA unavailable to HomeKit app. 

Disabling mDNS reflector on the USG and restarted HA solved this problem. I've already opened an issue to the developer of zeroconf, because libavahi (which is used by Homebridge) doesn't work in this way.

**Comment by cdce8p** [comment]
The issue for future reference: 
https://github.com/jstasiak/python-zeroconf/issues/157

CC: @stich86

**Comment by ikalchev** [comment]
@stich86 Congrats that you managed to fix your issue. You did quite the debugging. Sorry I couldn't join in.

Best,
Ivan

**Comment by eddsa** [comment]
@ikalchev, thanks for the great work. I am enjoying using the HA component. I'm still having issues that devices are not responding. Mostly it is happening when I am changing networks or going from one access point to the other. I do have the Ubiquiti APs, operating without USG.

However I have not changed the new file (HA_Server.py). My question is, whether it is getting automatically updated with the new version of Hassio? I am currently running version 0.89.

BTW I do have also issues finding the file via SSH connection. I found out that I require an root SSH connection. This was my understanding. That complicated the situation even more.

Your support is really much appreciated.

Regards. Edip

**Comment by eddsa** [comment]
Hi, maybe anyone else has an answer. Would be tel helpful. Regards.

**Comment by stich86** [comment]
@eddsa 

can you describe your network? it seems like you have some network parts like me (UAP)

**Comment by eddsa** [comment]
@stich86

Thanks for looking into this. You are right, I have one UAP AC Pro and two UAP AC lite. They are connected to a Unify Switch (8 ports with 60W and PoE). This is connected to my router (Fritzbox). On the Router I have switched off the Wlan.

Thanks again for your support.

**Comment by stich86** [comment]
Are you using same IP networks on each AP?

**Comment by eddsa** [comment]
If I understant it correctly, yes. All APs are linke to the UNifi Switch using the same SSID. I have not configured any VLANs

**Comment by psychogun** [comment]
I had a very outdated version of HA, so i did a 'pip Install -upgrade homeassistant' yesterday. I do not remember which version I was on, but 0.7 something? I am now on 0.93.2.
Then I noticed that I could not get anything working through the Apple Home App anymore. No contact error (?), with the Home Assistant Bridge.

So I decided to also upgrade my marthoc/deconz docker through 'sudo docker pull marthoc/deconz'. I was on Version 2.05.31, now I am on 2.05.64.  

That did not do it, either. So I stopped HA, deleted the .homekit.state file, and removed and added the Home Assistant Bridge in the Apple Home App with the new code provided. Then I saw I received notifications through the Apple Home App (like, 'motion detected' etc), but all of my accessories had a 'no response' error, even though they worked (turning on and off lights). 

So I Googled and came here. I replaced the hap_server.py file, as commented on 7th of December 2018, and that seems to do the trick. Just wanted to chime in and say thank you. 

VMware with Ubuntu 18.04.1 LTS and venv installation (as another user), python version 3.6.5.

**Comment by OddyAte** [comment]
Hello guys, I have the same issue and I wanted to try the fix of replacing the hap_server.py file, but I cannot find it anywhere via SCP. I am running the latest version of HomeAssistant (HassOS 2.12, 0.98.3, it's a Hassbian). Is this fix not applicable anymore?
